status,priority,target_page,opportunity_type,prospect,domain,anchor_theme,owner,target_date,notes
planned,high,/ielts/ielts-speaking-practice-online,guest_post,IELTS prep blogs,,ielts speaking practice online,marketing,2026-03-05,Pitch practical speaking framework article with link to guide.
planned,high,/ielts/ielts-writing-task-2-guide,resource_link,study resource roundups,,ielts writing task 2 guide,marketing,2026-03-05,Submit to curated IELTS resource pages.
planned,medium,/ielts/ielts-reading-question-types,partnership,education newsletters,,ielts reading question types,marketing,2026-03-12,Offer co-branded exam strategy summary.
planned,medium,/pricing,comparison_listing,saas directories,,ielts mock test pricing,marketing,2026-03-12,Add complete pricing and feature comparison listing.
planned,low,/editorial-policy,citation,education policy pages,,ielts content quality policy,marketing,2026-03-19,Reference editorial standards for trust signals.

